{
  "$schema": "tool-command-surface.schema.json",
  "schemaVersion": 1,
  "kind": "hosted-tool-command-surface-move-plan",
  "phase": "2.5",
  "entries": [
    { "ordinal": 1, "currentPath": "hosted_copilot/tools/AssessmentReconciliationValidation.psm1", "classification": "module", "plannedPath": "hosted_copilot/tools/modules/reconciliation/AssessmentReconciliationValidation.psm1", "purpose": "Validate assessment reconciliation behavior identities and references.", "documentationPath": null, "retirementInventoryId": null },
    { "ordinal": 2, "currentPath": "hosted_copilot/tools/Capture-ReviewPair.ps1", "classification": "maintainer-command", "plannedPath": "hosted_copilot/tools/commands/review/Capture-ReviewPair.ps1", "purpose": "Capture completed paired-review evidence.", "documentationPath": "hosted_copilot/tools/README.md", "retirementInventoryId": null },
    { "ordinal": 3, "currentPath": "hosted_copilot/tools/Close-ReviewPair.ps1", "classification": "maintainer-command", "plannedPath": "hosted_copilot/tools/commands/review/Close-ReviewPair.ps1", "purpose": "Close a captured paired-review run and clean up its disposable heads.", "documentationPath": "hosted_copilot/tools/README.md", "retirementInventoryId": null },
    { "ordinal": 4, "currentPath": "hosted_copilot/tools/Convert-InstructionCatalogV4.ps1", "classification": "migration-only", "plannedPath": "hosted_copilot/tools/migration/Convert-InstructionCatalogV4.ps1", "purpose": "Transform the legacy catalog sourceIds into version 4 relationships.", "documentationPath": null, "retirementInventoryId": "V3-RETIRE-MIGRATION-CATALOG-TRANSFORMER" },
    { "ordinal": 5, "currentPath": "hosted_copilot/tools/Generate-Instructions.ps1", "classification": "maintainer-command", "plannedPath": "hosted_copilot/tools/commands/catalog/Generate-Instructions.ps1", "purpose": "Check or regenerate Hosted instruction files from the canonical catalog.", "documentationPath": "hosted_copilot/tools/README.md", "retirementInventoryId": null },
    { "ordinal": 6, "currentPath": "hosted_copilot/tools/Get-GuidanceCapacity.ps1", "classification": "internal-implementation", "plannedPath": "hosted_copilot/tools/internal/workbench/Get-GuidanceCapacity.ps1", "purpose": "Produce the authoritative guidance-capacity reports consumed by generation and Workbench flows.", "documentationPath": null, "retirementInventoryId": null },
    { "ordinal": 7, "currentPath": "hosted_copilot/tools/HostedToolkit.Helpers.psm1", "classification": "module", "plannedPath": "hosted_copilot/tools/modules/shared/HostedToolkit.Helpers.psm1", "purpose": "Provide shared hashing, timestamp, and JSON snapshot helpers.", "documentationPath": null, "retirementInventoryId": null },
    { "ordinal": 8, "currentPath": "hosted_copilot/tools/Import-PullRequest.ps1", "classification": "maintainer-command", "plannedPath": "hosted_copilot/tools/commands/review/Import-PullRequest.ps1", "purpose": "Import an existing AzureRM pull request into the paired-review experiment.", "documentationPath": "hosted_copilot/tools/README.md", "retirementInventoryId": null },
    { "ordinal": 9, "currentPath": "hosted_copilot/tools/Initialize-ReviewBases.ps1", "classification": "maintainer-command", "plannedPath": "hosted_copilot/tools/commands/review/Initialize-ReviewBases.ps1", "purpose": "Initialize or verify the persistent paired-review experiment bases.", "documentationPath": "hosted_copilot/tools/README.md", "retirementInventoryId": null },
    { "ordinal": 10, "currentPath": "hosted_copilot/tools/Install-Toolkit.ps1", "classification": "maintainer-command", "plannedPath": "hosted_copilot/tools/Install-Toolkit.ps1", "purpose": "Plan or install the Hosted Toolkit payload into a target repository.", "documentationPath": "hosted_copilot/tools/README.md", "retirementInventoryId": null },
    { "ordinal": 11, "currentPath": "hosted_copilot/tools/Invoke-AssessmentReconciliation.ps1", "classification": "internal-implementation", "plannedPath": "hosted_copilot/tools/internal/reconciliation/Invoke-AssessmentReconciliation.ps1", "purpose": "Run complete assessment reconciliation over validated inputs.", "documentationPath": null, "retirementInventoryId": null },
    { "ordinal": 12, "currentPath": "hosted_copilot/tools/Invoke-RuleIntakeAssessment.ps1", "classification": "legacy-v3", "plannedPath": "hosted_copilot/tools/legacy-v3/Invoke-RuleIntakeAssessment.ps1", "purpose": "Run the active version 3 rule-intake assessment flow until cutover.", "documentationPath": null, "retirementInventoryId": "V3-RETIRE-PRODUCER-ASSESSMENT" },
    { "ordinal": 13, "currentPath": "hosted_copilot/tools/Invoke-SourceAssessment.ps1", "classification": "internal-implementation", "plannedPath": "hosted_copilot/tools/internal/assessment/Invoke-SourceAssessment.ps1", "purpose": "Assess one version 4 source lane and manage its exact cache identities.", "documentationPath": null, "retirementInventoryId": null },
    { "ordinal": 14, "currentPath": "hosted_copilot/tools/New-AssessmentReconciliationReview.ps1", "classification": "internal-implementation", "plannedPath": "hosted_copilot/tools/internal/reconciliation/New-AssessmentReconciliationReview.ps1", "purpose": "Build the complete version 4 Workbench review bundle.", "documentationPath": null, "retirementInventoryId": null },
    { "ordinal": 15, "currentPath": "hosted_copilot/tools/New-HostedRuleChangeRecommendations.ps1", "classification": "internal-implementation", "plannedPath": "hosted_copilot/tools/internal/reconciliation/New-HostedRuleChangeRecommendations.ps1", "purpose": "Build deterministic Hosted rule change recommendations from reconciled assessments.", "documentationPath": null, "retirementInventoryId": null },
    { "ordinal": 16, "currentPath": "hosted_copilot/tools/New-ReviewPair.ps1", "classification": "maintainer-command", "plannedPath": "hosted_copilot/tools/commands/review/New-ReviewPair.ps1", "purpose": "Create or synchronize one disposable paired-review run.", "documentationPath": "hosted_copilot/tools/README.md", "retirementInventoryId": null },
    { "ordinal": 17, "currentPath": "hosted_copilot/tools/New-RuleIntakeReview.ps1", "classification": "legacy-v3", "plannedPath": "hosted_copilot/tools/legacy-v3/New-RuleIntakeReview.ps1", "purpose": "Build the active version 3 rule-intake review bundle until cutover.", "documentationPath": null, "retirementInventoryId": "V3-RETIRE-PRODUCER-COLLECTOR" },
    { "ordinal": 18, "currentPath": "hosted_copilot/tools/New-SourceAssessmentBaseline.ps1", "classification": "internal-implementation", "plannedPath": "hosted_copilot/tools/internal/assessment/New-SourceAssessmentBaseline.ps1", "purpose": "Build a strict version 4 source-assessment baseline.", "documentationPath": null, "retirementInventoryId": null },
    { "ordinal": 19, "currentPath": "hosted_copilot/tools/New-SourceInventory.ps1", "classification": "internal-implementation", "plannedPath": "hosted_copilot/tools/internal/collection/New-SourceInventory.ps1", "purpose": "Collect and validate one configured version 4 source inventory.", "documentationPath": null, "retirementInventoryId": null },
    { "ordinal": 20, "currentPath": "hosted_copilot/tools/New-WorkbenchCodiconSprite.ps1", "classification": "internal-implementation", "plannedPath": "hosted_copilot/tools/internal/workbench/New-WorkbenchCodiconSprite.ps1", "purpose": "Regenerate the pinned Workbench Codicon sprite and preview.", "documentationPath": null, "retirementInventoryId": null },
    { "ordinal": 21, "currentPath": "hosted_copilot/tools/New-WorkbenchOcticonSprite.ps1", "classification": "internal-implementation", "plannedPath": "hosted_copilot/tools/internal/workbench/New-WorkbenchOcticonSprite.ps1", "purpose": "Regenerate the pinned Workbench Octicon sprite and preview.", "documentationPath": null, "retirementInventoryId": null },
    { "ordinal": 22, "currentPath": "hosted_copilot/tools/Publish-RuleIntakeAssessmentBaseline.ps1", "classification": "legacy-v3", "plannedPath": "hosted_copilot/tools/legacy-v3/Publish-RuleIntakeAssessmentBaseline.ps1", "purpose": "Publish the active version 3 assessment baseline until cutover.", "documentationPath": null, "retirementInventoryId": "V3-RETIRE-PRODUCER-BASELINE-PUBLISHER" },
    { "ordinal": 23, "currentPath": "hosted_copilot/tools/Publish-SourceGeneration.ps1", "classification": "internal-implementation", "plannedPath": "hosted_copilot/tools/internal/publication/Publish-SourceGeneration.ps1", "purpose": "Publish an accepted version 4 source generation atomically.", "documentationPath": null, "retirementInventoryId": null },
    { "ordinal": 24, "currentPath": "hosted_copilot/tools/Publish-TestCase.ps1", "classification": "maintainer-command", "plannedPath": "hosted_copilot/tools/commands/review/Publish-TestCase.ps1", "purpose": "Publish or validate one synthetic paired-review test case.", "documentationPath": "hosted_copilot/tools/README.md", "retirementInventoryId": null },
    { "ordinal": 25, "currentPath": "hosted_copilot/tools/Review.Common.psm1", "classification": "module", "plannedPath": "hosted_copilot/tools/modules/review/Review.Common.psm1", "purpose": "Provide shared paired-review GitHub and repository helpers.", "documentationPath": null, "retirementInventoryId": null },
    { "ordinal": 26, "currentPath": "hosted_copilot/tools/source-parsers/ContributorGuidanceV2.psm1", "classification": "module", "plannedPath": "hosted_copilot/tools/modules/source-parsers/ContributorGuidanceV2.psm1", "purpose": "Parse Contributor Guidance source documents into inventory records.", "documentationPath": null, "retirementInventoryId": null },
    { "ordinal": 27, "currentPath": "hosted_copilot/tools/source-parsers/InteractiveToolkitV2.psm1", "classification": "module", "plannedPath": "hosted_copilot/tools/modules/source-parsers/InteractiveToolkitV2.psm1", "purpose": "Parse the Interactive Toolkit catalog into inventory records.", "documentationPath": null, "retirementInventoryId": null },